Review Title,Rating,Review Body,Review Date,cleaned_body,Sentiment
A superb piece of a processor,5.0 out of 5 stars,"No doubt, 12th gen Intel processors are a marvel of computing technology. Although there is a continuing tug of war between Intel and AMD in this regard. I personally chose Intel Core i7 (12700K) with inbuilt UHD graphics for my newly built desktop PC. For those, who don't want to use a separate and usually exorbitantly priced graphics cards, this processor is a very good alternative. It can handle most of the processing intensive rendering of Blender easily with its unlocked overclocking (obviously you have to use the supporting motherboard, i.e. presently available Z690 chipset motherboards). It can also smoothly handle almost all the tasks of Adobe Lightroom and Photoshop with no hiccups. Not to mention the support of 4K video with HDR if you are looking for some decent and the latest entertainment in your PC. I would suggest this 12th Gen i7 to those who want to use their PC for content creation purpose in the best possible way and also at the same time save some money (compared to 12th Gen i9, which would ideally be the best anyway, but costlier too). The price is still at a high level. Hopefully this comes down soon with the launch of Intel's 13th Gen processors!",28 June 2022,"doubt , 12th gen Intel processors marvel computing technology . Although continuing tug war Intel AMD regard . personally chose Intel Core i7 ( 12700K ) inbuilt UHD graphics newly built desktop PC . , n't want use separate usually exorbitantly priced graphics cards , processor good alternative . handle processing intensive rendering Blender easily unlocked overclocking ( obviously use supporting motherboard , i.e . presently available Z690 chipset motherboards ) . also smoothly handle almost tasks Adobe Lightroom Photoshop hiccups . mention support 4K video HDR looking decent latest entertainment PC . would suggest 12th Gen i7 want use PC content creation purpose best possible way also time save money ( compared 12th Gen i9 , would ideally best anyway , costlier ) . price still high level . Hopefully comes soon launch Intel 's 13th Gen processors !",Competition Sentiment
Beast processor with Intel UHD shared Graphics,5.0 out of 5 stars,"I have paired this processor with Asus Prime Z690A motherboard and 32G 5200Mhz DDR5 ram. My usage is mostly for Adobe suite for 4K video rendering & photoediting (without dedicated eGPU) and ocassonal AAA title gaming like GTA5, Battlefield, Cpunk,etc.The processor works like a charm for rendering and Games upto 75Hz in 1080p ultra setting.Overall good processor for the price and more review to come in future edits.",29 March 2022,"paired processor Asus Prime Z690A motherboard 32G 5200Mhz DDR5 ram . usage mostly Adobe suite 4K video rendering & photoediting ( without dedicated eGPU ) ocassonal AAA title gaming like GTA5 , Battlefield , Cpunk , etc.The processor works like charm rendering Games upto 75Hz 1080p ultra setting.Overall good processor price review come future edits .",Competition Sentiment
No title,No rating,"The Intel Core i7-12700K has significantly enhanced my gaming and productivity experience. This processor combines raw power with excellent integrated graphics, making it an ideal choice for both gamers and professionals.",28 June 2024,"Intel Core i7-12700K significantly enhanced gaming productivity experience . processor combines raw power excellent integrated graphics , making ideal choice gamers professionals .",Positive
No title,No rating,This cpu is very powerful and can run games (when paired with a good graphics card) up to 300+ FPS without any problems or stutters. Make sure that you keep it cooled with a good cooler as well. It is also a great price for the product you are getting.,26 June 2024,cpu powerful run games ( paired good graphics card ) 300+ FPS without problems stutters . Make sure keep cooled good cooler well . also great price product getting .,Positive
No title,No rating,"Big improvement going from 4 cores to 20 cores. Too bad about the price, though. It's unlocked and I've got it running at plus 41 percent. I guess I just verbally kissed my warranty goodbye.",24 June 2024,"Big improvement going 4 cores 20 cores . bad price , though . 's unlocked 've got running plus 41 percent . guess verbally kissed warranty goodbye .",Positive
No title,No rating,"Well if I buy a computer the very first thing it has to do is boot. If it doesn't do that than all else is a failure. I will probably give it another try tomorrow, otherwise it will be going back.",24 June 2024,"Well buy computer first thing boot . n't else failure . probably give another try tomorrow , otherwise going back .",Negative
No title,No rating,"I like the integrated graphics as I'm not using it for high-end gaming. I was disappointment to find it didn't come with a cooler. I've been spoiled by AMD. Also it was difficult to fit it into the socket to the point that I was worried about damaging it. Things worked out in the end and I have no complaints about its operation now. Three months in, no problems.",24 June 2024,"like integrated graphics 'm using high-end gaming . disappointment find n't come cooler . 've spoiled AMD . Also difficult fit socket point worried damaging . Things worked end complaints operation . Three months , problems .",Competition Sentiment
No title,No rating,"Amazing CPU previously had a i3 12100f so for me it was an extreme upgrade. Extra, more stable fps in pretty much all my games. Can also tune with intel xtu which is a good feature to have.",22 June 2024,"Amazing CPU previously i3 12100f extreme upgrade . Extra , stable fps pretty much games . also tune intel xtu good feature .",Positive
No title,No rating,I was too high in high.,17 June 2024,high high .,Neutral
No title,No rating,"Great CPU, put it in a new personal gaming rig and it hits 5.3ghz out of the box no tweaking and runs stable as can be. Very happy.",12 June 2024,"Great CPU , put new personal gaming rig hits 5.3ghz box tweaking runs stable . happy .",Positive
No title,No rating,"For me the best of the last three generations of Intel, a decent TDP, I have no temperature problems or any problem, I recommend it.",4 June 2024,"best last three generations Intel , decent TDP , temperature problems problem , recommend .",Neutral
No title,No rating,perform,29 May 2024,perform,Neutral
No title,No rating,"Does exactly what it's supposed to do, my computer works great",23 May 2024,"exactly 's supposed , computer works great",Positive
No title,No rating,Exactly what I needed,23 May 2024,Exactly needed,Neutral
No title,No rating,Got it as an upgrade over my old 8700k and this is a huge upgrade. I do recommend installing a contact frame such as the thermalright for this CPU,17 May 2024,Got upgrade old 8700k huge upgrade . recommend installing contact frame thermalright CPU,Positive
No title,No rating,"runs Microsoft Flight simulator on multiple 32"" screens beautifully.",13 May 2024,runs Microsoft Flight simulator multiple 32 '' screens beautifully .,Positive
No title,No rating,Greater than 15% 15%,2 May 2024,Greater 15 % 15 %,Positive
No title,No rating,"Received used, discolored processor in previously opened box.  Evidence of thermal paste having been applied and cleaned off prior to receiving.  Returning.",19 April 2024,"Received used , discolored processor previously opened box . Evidence thermal paste applied cleaned prior receiving . Returning .",Neutral
No title,No rating,BE AWARE THIS CPU DOES NOT COME WITH A HEATSINK NOR IS IT PACKAGED WELL. CPU IN PLASTIC CASE RATTLING AROUND IN THE BOX. EXTREMELY DISAPPOINTED.,17 April 2024,AWARE CPU COME HEATSINK PACKAGED WELL . CPU PLASTIC CASE RATTLING AROUND BOX . EXTREMELY DISAPPOINTED .,Negative
No title,No rating,I heard good things about this cpu and went for it. Budget friendly and a very good cpu!,10 April 2024,heard good things cpu went . Budget friendly good cpu !,Positive
No title,No rating,"So, being an AMD fanboy, I was not keen on getting this, but the c/t (cores to threads) kinda caught my eye. Running 12 cores, and 20 threads (4 e-cores i think) I thought, well, for the price, it should be okay?I was wrong...This cpu is a monster in my eyes. Running with 32GB of ram (ddr4) and matched with the RTX 4070 GPU being cooled by the Artic Liquid Freezer ii, there is nothing stopping this from performing to its max. I would recommend this piece of kit to anyone, starting out or continuing on with building computers for their ""high end"" gaming etc. I have not once seen this struggle.",10 April 2024,", AMD fanboy , keen getting , c/t ( cores threads ) kinda caught eye . Running 12 cores , 20 threads ( 4 e-cores think ) thought , well , price , okay ? wrong ... cpu monster eyes . Running 32GB ram ( ddr4 ) matched RTX 4070 GPU cooled Artic Liquid Freezer ii , nothing stopping performing max . would recommend piece kit anyone , starting continuing building computers `` high end '' gaming etc . seen struggle .",Competition Sentiment
No title,No rating,Perfect,9 April 2024,Perfect,Positive
No title,No rating,I have changed all the components of my PC and since I bought the processor I arrived with failures I could not write because I am very busy state,8 April 2024,changed components PC since bought processor arrived failures could write busy state,Negative
No title,No rating,"Working well, stable and can be overclock - with correct cooling setup. Good price too.",2 April 2024,"Working well , stable overclock - correct cooling setup . Good price .",Positive
No title,No rating,Used at work.,19 March 2024,Used work .,Neutral
No title,No rating,Huge upgrade from 8th gen i5! paired it with the ASRock Z690 and 32g DDR4,15 March 2024,Huge upgrade 8th gen i5 ! paired ASRock Z690 32g DDR4,Positive
No title,No rating,"A great performance, cheap enough for the performance it gives. I got this for 210$ on BF. Recommend!",3 March 2024,"great performance , cheap enough performance gives . got 210 $ BF . Recommend !",Positive
No title,No rating,Great,2 March 2024,Great,Positive
No title,No rating,This appears to be the best option for intel at this price range. Works as advertised.,25 February 2024,appears best option intel price range . Works advertised .,Positive
No title,No rating,"The Media Could Not Be Loaded.




I will see how it behaves when you make my assembly",25 February 2024,Media Could Loaded . see behaves make assembly,Neutral
No title,No rating,"Great cpu, would buy again.",19 February 2024,"Great cpu , would buy .",Positive
No title,No rating,Great product/Brand Intel i7 CPU. I have been using the Intel brand CPU's and have been using the i7 and the K series since they were introduced. This seems to handle video processing and CAD/CAM projects quite well. I have always had great luck with Intel brand processors and will continue using them. Pretty good value for the cost.,17 February 2024,Great product/Brand Intel i7 CPU . using Intel brand CPU 's using i7 K series since introduced . seems handle video processing CAD/CAM projects quite well . always great luck Intel brand processors continue using . Pretty good value cost .,Positive
No title,No rating,"As usual at Intel is very good, the perfs are just incredible with the native boost, I succeeded at the OC up to 5.2GHz and I am sure that we can go up again with a water custom.Only defect is that very quickly when you take a 4080 it pulls the tongue a little in 4K.I will have to change it after 2 years because of Bottleck, but on a config with a 3080 (TI) it must be a very beautiful synergy. Very good on processor tasks too, to use it to do a little rendering themPerfs are really good.",13 February 2024,"usual Intel good , perfs incredible native boost , succeeded OC 5.2GHz sure go water custom.Only defect quickly take 4080 pulls tongue little 4K.I change 2 years Bottleck , config 3080 ( TI ) must beautiful synergy . good processor tasks , use little rendering themPerfs really good .",Positive
No title,No rating,"Excellent processor, mounted on the PC perfectly without hitches, holds very well the simple games even without video card",13 February 2024,"Excellent processor , mounted PC perfectly without hitches , holds well simple games even without video card",Positive
No title,No rating,Good enough for this price range,6 February 2024,Good enough price range,Positive
No title,No rating,I received the product with the promptness of the case.I arrive sealed and in a box with another product.The operation is good and not usually heated with a good air cooling system.,5 February 2024,received product promptness case.I arrive sealed box another product.The operation good usually heated good air cooling system .,Positive
No title,No rating,Arrived loose in the box. So every bump not only did it bounce in the box it was shipped in but the retail box is were it was loose. hope it works when the motherboard arrives.,4 February 2024,Arrived loose box . every bump bounce box shipped retail box loose . hope works motherboard arrives .,Future Expectations
No title,No rating,got it the next day as stated and was exactly as advertised. Yes would buy from again,3 February 2024,got next day stated exactly advertised . Yes would buy,Positive
No title,No rating,It's a top-of-the-line CPU that will last for a long time. There's nothing to dislike about it.it replaced a 12 year 3770K!,2 February 2024,'s top-of-the-line CPU last long time . 's nothing dislike it.it replaced 12 year 3770K !,Positive
No title,No rating,Everything is so good,2 February 2024,Everything good,Positive
No title,No rating,"This is a very good product, and there are no issues with its features and performance. The usage process is also very smooth, and there hasn't been any overheating so far.",30 January 2024,"good product , issues features performance . usage process also smooth , n't overheating far .",Positive
No title,No rating,"I bought it when I was special, and there was no problem in use, and the money was worth it.I PURCHASED It at a Special Price, and I haven't enCountered any issues in terms of usage. It offers great value for the money.",29 January 2024,"bought special , problem use , money worth it.I PURCHASED Special Price , n't enCountered issues terms usage . offers great value money .",Positive
No title,No rating,"This is my first intel build coming from past AMD builds (Ryzen, FX, Athlon, Phenom). I am nowhere near a hardware engineer level to distinguish or feel the differences in performances but for the average gamer and turning on this CPU with instructions followed, this chip is very well to be worth it and confident to be future proof until at least 2026. I overclocked this via the motherboard/bios settings and it stays cool with a $30 fan cooler. (don't get a super cheap or small cpu cooler otherwise would risk overheating) Just follow installation instructions carefully the chip is delicate. windows experience rating is a 9.7 so that says it all. If you have the extra 50-60$ go with the i9 i should have done that. AMD seems to be all the hype but I see why Intel won't be going away anytime soon this is a solid chip.",24 January 2024,"first intel build coming past AMD builds ( Ryzen , FX , Athlon , Phenom ) . nowhere near hardware engineer level distinguish feel differences performances average gamer turning CPU instructions followed , chip well worth confident future proof least 2026 . overclocked via motherboard/bios settings stays cool $ 30 fan cooler . ( n't get super cheap small cpu cooler otherwise would risk overheating ) follow installation instructions carefully chip delicate . windows experience rating 9.7 says . extra 50-60 $ go i9 done . AMD seems hype see Intel wo n't going away anytime soon solid chip .",Competition Sentiment
No title,No rating,"Went from a 9400f to this was a big different on gaming, i finally get the fully potencial of my gpu",24 January 2024,"Went 9400f big different gaming , finally get fully potencial gpu",Neutral
No title,No rating,"For my needs, it’s the perfect “bang for the buck” balance between performance and price.",18 January 2024,"needs , ’ perfect “ bang buck ” balance performance price .",Positive
No title,No rating,Excellent cpu and great value,18 January 2024,Excellent cpu great value,Positive
No title,No rating,This is a second purchase of core i7 12700. It works very well as expected.,18 January 2024,second purchase core i7 12700 . works well expected .,Future Expectations
No title,No rating,"Have been on team Blue for years now and coming off a 7XXX i5, this is a huge upgrade! Haven't looked into overclocking but having a K processor future proof me for that!",17 January 2024,"team Blue years coming 7XXX i5 , huge upgrade ! n't looked overclocking K processor future proof !",Future Expectations
No title,No rating,Relatively fast delivery and processor delivered new,17 January 2024,Relatively fast delivery processor delivered new,Neutral
No title,No rating,If you're looking for an Intel cpu I would recommend this even though it is a couple years old now I belive its still the best intel cpu for gaming,16 January 2024,'re looking Intel cpu would recommend even though couple years old belive still best intel cpu gaming,Positive
No title,No rating,Nearly all my games were crashing using this 12 Gen cpu. I later found out most games doesn’t run on alder lake due to some anti cheat bug and you need to disable e cores in the bios and am not putting up with it. I returned it and will be upgrading to 13 or 14th Gen instead.,16 January 2024,Nearly games crashing using 12 Gen cpu . later found games ’ run alder lake due anti cheat bug need disable e cores bios putting . returned upgrading 13 14th Gen instead .,Negative
No title,No rating,"the one i bought one year ago had instability. didn't know it was the CPU until it really started acting up. had to do a lot of tests with different component to finally be able to pinpoint the CPU. When i reached out to Intel, they Informed me about a policy about ''tray'' processor and ''boxed'' processor. basically a tray processor is sold in bulk and they don't cover warranty. As for Boxed processor, they are sold by certain compagny and cost usually more. Fortunatly, the one i got was a boxed one, but still Intel told me i had a ''tray'' processor. i had to go on their website and enter my product information and send them the proof that their website is saying i have a ''box'' processor. It was a bit unnerving, but at the en, they offered me the warranty and i'm supposed to receive a new one when they finish processing the one i sent them.",12 January 2024,"one bought one year ago instability . n't know CPU really started acting . lot tests different component finally able pinpoint CPU . reached Intel , Informed policy `` tray '' processor `` boxed '' processor . basically tray processor sold bulk n't cover warranty . Boxed processor , sold certain compagny cost usually . Fortunatly , one got boxed one , still Intel told `` tray '' processor . go website enter product information send proof website saying `` box '' processor . bit unnerving , en , offered warranty 'm supposed receive new one finish processing one sent .",Positive
No title,No rating,"Just be sure to match up the chip correctly on the socket (one corner has a triangle cutout)Easy to install.Runs smooth and is not a power hog or a supernova in terms of heat.Even at load, it performs well.Perfect for gaming, no issues in keeping up with GPU.",9 January 2024,"sure match chip correctly socket ( one corner triangle cutout ) Easy install.Runs smooth power hog supernova terms heat.Even load , performs well.Perfect gaming , issues keeping GPU .",Neutral
No title,No rating,"Great CPU for multitasking, I don't know too much about CPU but this is great!",5 January 2024,"Great CPU multitasking , n't know much CPU great !",Positive
No title,No rating,Good value purchase to build a system.,29 December 2023,Good value purchase build system .,Positive
No title,No rating,"Basic processor used from my home PC, does exactly what was requested and ordered",28 December 2023,"Basic processor used home PC , exactly requested ordered",Neutral
No title,No rating,"I've installed a 10th gen 2x, 12th gen, and a 13th gen on my family's pc's. I've never had a problem.",28 December 2023,"'ve installed 10th gen 2x , 12th gen , 13th gen family 's pc 's . 've never problem .",Positive
No title,No rating,Great value for 12th gen CPU.,23 December 2023,Great value 12th gen CPU .,Positive
No title,No rating,Big upgrade from my 9 years old 5820K.,19 December 2023,Big upgrade 9 years old 5820K .,Neutral
No title,No rating,The red LED on the motherboard indicates CPU failure.,17 December 2023,red LED motherboard indicates CPU failure .,Negative
No title,No rating,Great processor chip! A much more improvement then my i7 4770k.,16 December 2023,Great processor chip ! much improvement i7 4770k .,Positive
No title,No rating,"At this time in the product life cycle, the 12th gen CPU is about half the cost of the 14th gen CPU.  It is more than fast enough for everything I do.  My major reason for upgrading was my old motherboard did not have TPM 2.0.  The CPU was easy to install, it is running between 36-37 degrees Celsius (though I admit I am not stressing it).  I am very happy with my purchase.",10 December 2023,"time product life cycle , 12th gen CPU half cost 14th gen CPU . fast enough everything . major reason upgrading old motherboard TPM 2.0 . CPU easy install , running 36-37 degrees Celsius ( though admit stressing ) . happy purchase .",Positive
No title,No rating,Great product,9 December 2023,Great product,Positive
No title,No rating,"Compared to the Coffee Lake generation I had been (willingly) stuck on for 4 years this is a massive leap. Before buying I was a bit skeptical since I'm not a fan of Intel's newer way of handling cores, but the first thing I tried when I got it was emulating PS3 games and right off the bat I saw compile times cut tenfold and stability at least doubled.The older CPUs from the 8th, 9th, and 10th gen are perfectly usable for most people so if you're on a budget maybe look on the used market for those. But if you really need something powerful this is a good option.",4 December 2023,"Compared Coffee Lake generation ( willingly ) stuck 4 years massive leap . buying bit skeptical since 'm fan Intel 's newer way handling cores , first thing tried got emulating PS3 games right bat saw compile times cut tenfold stability least doubled.The older CPUs 8th , 9th , 10th gen perfectly usable people 're budget maybe look used market . really need something powerful good option .",Positive
No title,No rating,"The morning after building and setting up windows, drivers, etc. The PC had blue screened because of temperatures, and after a reset and entering the BIOS I saw that the temperature was 89 degrees celsius. Thankfully, after some trial and error I was able to undervolt it and not have my CPU die. I'd suggest anyone who looks into getting an intel CPU to undervolt it!",2 December 2023,"morning building setting windows , drivers , etc . PC blue screened temperatures , reset entering BIOS saw temperature 89 degrees celsius . Thankfully , trial error able undervolt CPU die . 'd suggest anyone looks getting intel CPU undervolt !",Negative
No title,No rating,"Wow what an incredible black Friday deal. Seriously, $211 is well worth it for the performance. I also purchased the 12600k for $153 which is another unbeatable deal offered this year at amazon. If you managed to get your hands on either one of you made the right choice.",1 December 2023,"Wow incredible black Friday deal . Seriously , $ 211 well worth performance . also purchased 12600k $ 153 another unbeatable deal offered year amazon . managed get hands either one made right choice .",Positive
No title,No rating,"for my limited budget, I bought it, While the 12700K isn't the top of the line, at least for me, it was more affordable and very performant. I've had good success overclocking it and actually undervolting  it to reduce temperatures!",30 November 2023,"limited budget , bought , 12700K n't top line , least , affordable performant . 've good success overclocking actually undervolting reduce temperatures !",Positive
No title,No rating,Runs windows 1,23 November 2023,Runs windows 1,Neutral
No title,No rating,"I got the CPU on sale and I would say the performance is great, my application is running smoothly and does not come into any problem for a year now.",22 November 2023,"got CPU sale would say performance great , application running smoothly come problem year .",Positive
No title,No rating,"this thing is a workhorse! ive got mine clocked to 5.0GHz and it runs like a dream, keep in mind this unit will require a water pump air coolers are not enough!",16 November 2023,"thing workhorse ! ive got mine clocked 5.0GHz runs like dream , keep mind unit require water pump air coolers enough !",Positive
No title,No rating,Classic Intel of medium -sided gaming and productivity CPU.Perfect packaging and no installation problems. The latest 14^ generation Intel CPU exits. The price should settle around € 280-300 to become a best buy,26 October 2023,Classic Intel medium -sided gaming productivity CPU.Perfect packaging installation problems . latest 14^ generation Intel CPU exits . price settle around € 280-300 become best buy,Positive
No title,No rating,Very fast in Gaming,25 October 2023,fast Gaming,Neutral
