Review Title,Rating,Review Body,Review Date,cleaned_body,Sentiment
No title,No rating,Bought in prime days brand new. Processor came dead on arrival. Amazon customer support refused to exchange the processor for a working one. Very bad experience.Processor was sold and shipped by amazon too,21 October 2023,Bought prime days brand new . Processor came dead arrival . Amazon customer support refused exchange processor working one . bad experience.Processor sold shipped amazon,Competition Sentiment
No title,No rating,Because the 12-th CPU was cheap I decided to buy a 12700K. It's awesome.,19 October 2023,12-th CPU cheap decided buy 12700K . 's awesome .,Positive
No title,No rating,"I arrive in perfect condition, highly recommended",18 October 2023,"arrive perfect condition , highly recommended",Positive
No title,No rating,"The processor is excellent, I use the PC for streaming and gaming and makes its duty without problems.But when I bought it, it had risen too much to price compared to other processors and quality-price.It works very well at the moment, in use for a month.",4 October 2023,"processor excellent , use PC streaming gaming makes duty without problems.But bought , risen much price compared processors quality-price.It works well moment , use month .",Positive
No title,No rating,a brand new one has arrived everything is working well,2 October 2023,brand new one arrived everything working well,Positive
No title,No rating,Nothing to say and it does not heat (28c at rest) even without water cooling,25 September 2023,Nothing say heat ( 28c rest ) even without water cooling,Neutral
No title,No rating,"Paired it with an ASUS MOBO and a Lian Li 360mm AIO.Runs cool, no performance issues, and no bottlenecks for the gaming i use it for.",24 September 2023,"Paired ASUS MOBO Lian Li 360mm AIO.Runs cool , performance issues , bottlenecks gaming use .",Negative
No title,No rating,"Bought this for a new personal PC. My last was an i7 4790K build that got totaled out (crushed) during shipping. After building a new one on a z790i platform, the performance gain was stunning, completely night and day! I cannot say enough about this CPU, and would totally recommend this product!!",22 September 2023,"Bought new personal PC . last i7 4790K build got totaled ( crushed ) shipping . building new one z790i platform , performance gain stunning , completely night day ! say enough CPU , would totally recommend product ! !",Positive
No title,No rating,"I upgraded from the i7 6700k to the i3 13100 and saw a great performance increase. I was eager to test ddr5. However,  I also wanted to experiment with 6+ core processors. Fortunately I found this i7 12700k when the price dropped to 275. I wasn't sure if it would be a big increase from the i3 and the i7 6700k. But the i7 12700k is a ferocious beast that has crushed all tasks I've given it and brought immesnse life back to my RTX 2060 super and it stays cools & fluent.Z790 auros elite axI7 12700k overclocked pcores 5.2 ghz ecores 4.0 ghz 50-65°C during multi intensive tasks and games for long periods of timeRTX 2060 super 8bg ddr6Corsair vengeance 6000mhz ddr5Cyberpunk 60-65 fps 1080 ultra+psycho with medium ray tracing with a low of 59Starfield 30- 40 1080p fps high settings the devs need to optimize thoughHorizon zero Dawn 80-85 fps 1080 ultraShreds through video editing and music editing all at onceAmazing at multitaskingPowerfulFastCan be placed in ddr4 mobos and ddr5 mobos",22 September 2023,"upgraded i7 6700k i3 13100 saw great performance increase . eager test ddr5 . However , also wanted experiment 6+ core processors . Fortunately found i7 12700k price dropped 275 . n't sure would big increase i3 i7 6700k . i7 12700k ferocious beast crushed tasks 've given brought immesnse life back RTX 2060 super stays cools & fluent.Z790 auros elite axI7 12700k overclocked pcores 5.2 ghz ecores 4.0 ghz 50-65°C multi intensive tasks games long periods timeRTX 2060 super 8bg ddr6Corsair vengeance 6000mhz ddr5Cyberpunk 60-65 fps 1080 ultra+psycho medium ray tracing low 59Starfield 30- 40 1080p fps high settings devs need optimize thoughHorizon zero Dawn 80-85 fps 1080 ultraShreds video editing music editing onceAmazing multitaskingPowerfulFastCan placed ddr4 mobos ddr5 mobos",Positive
No title,No rating,"This is my first 1700 socket processor, so I can't really give it a proper speed review , however it was very simple to install , just be very very careful !!",4 September 2023,"first 1700 socket processor , ca n't really give proper speed review , however simple install , careful ! !",Positive
No title,No rating,Excelent product!!!!!,30 August 2023,Excelent product ! ! ! ! !,Neutral
No title,No rating,It is what is expected of its specifications.,23 August 2023,expected specifications .,Future Expectations
No title,No rating,Good.......,19 August 2023,Good .......,Neutral
No title,No rating,"Works fine, no questions",16 August 2023,"Works fine , questions",Negative
No title,No rating,Narrowed down a problem to this GPU. Everything else was replaced trying to figure out a boot issue and once I swapped to a different GPU it fired right up. Too bad now I'm outside of the return window since it took about a month to figure out. I'll have to go through the warranty process with Intel now.,11 August 2023,Narrowed problem GPU . Everything else replaced trying figure boot issue swapped different GPU fired right . bad 'm outside return window since took month figure . 'll go warranty process Intel .,Negative
No title,No rating,"It's pretty good value for money (as far as intel CPUs are concerned...) for a 12th gen CPU, but if you're looking for the BETTER value get the i5-13600K which outperforms it at pretty much the same cost while being a 13th gen CPU. The only real downside of the 13600k is that it generally requires a 13th gen compatible motherboard, otherwise you'll need to FLASH THE BIOS on a 12th gen compatible motherboard to update the motherboard for it to be able to read 13th gen CPU (I highly do not recommend doing this). I've tried it a few and it's such a big hassle (many potential issues...)that I recommend first time PC builders or part buyers to just save yourself a headache and buy a 13th gen CPU, along with a 13th gen compatible motherboard (don't buy 12th gen mobo) which obviously doesn't require flashing bios for the 13600k to be usable.",5 August 2023,"'s pretty good value money ( far intel CPUs concerned ... ) 12th gen CPU , 're looking BETTER value get i5-13600K outperforms pretty much cost 13th gen CPU . real downside 13600k generally requires 13th gen compatible motherboard , otherwise 'll need FLASH BIOS 12th gen compatible motherboard update motherboard able read 13th gen CPU ( highly recommend ) . 've tried 's big hassle ( many potential issues ... ) recommend first time PC builders part buyers save headache buy 13th gen CPU , along 13th gen compatible motherboard ( n't buy 12th gen mobo ) obviously n't require flashing bios 13600k usable .",Positive
No title,No rating,"This item has been with me for a very short time.So I recently decided to upgrade my gaming rig, and after extensive research, I made the bold choice to order the Intel Core i7-12700K Gaming Desktop Processor with Integrated Graphics and 12 Cores. Let me tell you, this processor is the absolute best! With its 12 cores, it brings a whole new level of performance to my gaming experience. Whether I'm playing graphically demanding AAA titles or indulging in intense multitasking, this processor effortlessly handles it all. And what's even better is that it comes with integrated graphics, meaning I didn't have to shell out extra cash for a separate graphics card, yet. The integrated Graphics offer the flexibility of running dual displays smoothly without any hiccups. Plus, with Intel's reputation for reliable and high-quality products, I know I can trust the i7-12700K to last me for years to come.I hope you find this review helpful.",5 August 2023,"item short time.So recently decided upgrade gaming rig , extensive research , made bold choice order Intel Core i7-12700K Gaming Desktop Processor Integrated Graphics 12 Cores . Let tell , processor absolute best ! 12 cores , brings whole new level performance gaming experience . Whether 'm playing graphically demanding AAA titles indulging intense multitasking , processor effortlessly handles . 's even better comes integrated graphics , meaning n't shell extra cash separate graphics card , yet . integrated Graphics offer flexibility running dual displays smoothly without hiccups . Plus , Intel 's reputation reliable high-quality products , know trust i7-12700K last years come.I hope find review helpful .",Future Expectations
No title,No rating,"I received the processor with the safety seal broken, so far everything works correctly but I did not like this to be like this",5 August 2023,"received processor safety seal broken , far everything works correctly like like",Negative
No title,No rating,Works great with my 4070. No complaints here other than it could be cheaper.,28 July 2023,Works great 4070 . complaints could cheaper .,Positive
No title,No rating,thank you,26 July 2023,thank,Positive
No title,No rating,I bought this for my 13 year old son for a PC gaming buildWhen this is on sale for 219.99 its a immediate buy!Such great performance for the price - It's out performing my i-9Buy it you wont be sorry!,26 July 2023,bought 13 year old son PC gaming buildWhen sale 219.99 immediate buy ! great performance price - 's performing i-9Buy wont sorry !,Positive
No title,No rating,It works perfectly.I notice the difference since I come from an eighth generation.And with a 4070 GPU I will have more experience about it.,26 July 2023,works perfectly.I notice difference since come eighth generation.And 4070 GPU experience .,Neutral
No title,No rating,"The heart of my PC build and wanted to have the ""K"" version with the Integrated Graphics... even though I was going to have a GPU anyways, it's a good backup if the GPU fails.Can't do a Pro and Con here as there is nothing much to report.It plays every game without bottlenecking my RTX 3070 and was a breeze to install (there is literally one way to install it. <You'd have to intentionally or forcibly install it wrong).Also, it runs surprisingly cool and doesn't act like an easy-bake oven in my Motherboard.",25 July 2023,"heart PC build wanted `` K '' version Integrated Graphics ... even though going GPU anyways , 's good backup GPU fails.Ca n't Pro Con nothing much report.It plays every game without bottlenecking RTX 3070 breeze install ( literally one way install . < 'd intentionally forcibly install wrong ) .Also , runs surprisingly cool n't act like easy-bake oven Motherboard .",Positive
No title,No rating,"So far so good, but then that's what I said about the last one...  I'll check back in a year on this and hope it outlasts my prior CPU.As for the last one... it's Intel dropping the ball with their QC it seems.  Had an IMC function poorly and finally give up the ghost and refuse to post with more than one memory module installed.  Couldn't run any XMP profiles, and swapping the processor solved it (not a Mobo issue).Just watch for funky behavior when you buy this gen, and return it if *anything* seems even *remotely* off.",21 July 2023,"far good , 's said last one ... 'll check back year hope outlasts prior CPU.As last one ... 's Intel dropping ball QC seems . IMC function poorly finally give ghost refuse post one memory module installed . Could n't run XMP profiles , swapping processor solved ( Mobo issue ) .Just watch funky behavior buy gen , return * anything * seems even * remotely * .",Future Expectations
No title,No rating,"Bought this for my new upgraded setup, I decided to pick this processor to replace my old i7 4790K, although it was still running strong after many years it was starting to show signs of aging so I completely went from 4th gen to 12th gen, performance in gaming and business apps is really noticeable.",20 July 2023,"Bought new upgraded setup , decided pick processor replace old i7 4790K , although still running strong many years starting show signs aging completely went 4th gen 12th gen , performance gaming business apps really noticeable .",Positive
No title,No rating,Not that tech savvy with computer parts but this definitely is a powerful component to my build. Happy I purchased on sale.,16 July 2023,tech savvy computer parts definitely powerful component build . Happy purchased sale .,Positive
No title,No rating,"Not much to say about this cpu. It's Intel, and these are immortal. Still have the 3770K I got like 10 years ago, and an Extreme I got even earlier than that.So the main motive here is to let Amazon know that I HAVE received the item, but I don't know how to let them know so they can change the ""package left at mail"" to ""Already received""...",16 July 2023,"much say cpu . 's Intel , immortal . Still 3770K got like 10 years ago , Extreme got even earlier that.So main motive let Amazon know received item , n't know let know change `` package left mail '' `` Already received '' ...",Positive
No title,No rating,Intel CPU is good,14 July 2023,Intel CPU good,Positive
